[
  {
    "execution_id": "infer-contract-1",
    "tenant_id": "tenant",
    "model_id": "model",
    "version_id": "v1",
    "entity_id": "42",
    "inferred_at": "2026-10-29T00:00:00Z",
    "pred_label": "是",
    "pred_probability": 0.8,
    "pred_probabilities": null,
    "pred_value": null,
    "pred_extra": "{\"inference_feature_values\": [{\"feature_name\": \"opaque_feature_A\", \"value\": 1}, {\"feature_name\": \"opaque_feature_B\", \"value\": 1}]}"
  }
]
